# tcpdump -c 6 -i eth0 
                                                                                                              130 тип
tcpdump: verbose output suppressed, use -v or -vv for full protocol decode
listening on eth0, link-type EN10MB (Ethernet), capture size 262144 bytes
18:41:48.164571 IP 192.168.2.24.43980 > 239.255.255.250.15600: UDP, length 35
18:41:48.165097 IP 192.168.2.66.46793 > mynetwork.domain: 14380+ PTR? 250.255.255.239.in-addr.arpa. (46)
18:41:48.189138 IP mynetwork.domain > 192.168.2.66.46793: 14380 NXDomain 0/1/0 (103)
18:41:48.189332 IP 192.168.2.66.52359 > mynetwork.domain: 18478+ PTR? 24.2.168.192.in-addr.arpa. (43)
18:41:48.190951 IP mynetwork.domain > 192.168.2.66.52359: 18478 NXDomain* 0/0/0 (43)
18:41:48.191186 IP 192.168.2.66.36215 > mynetwork.domain: 54458+ PTR? 1.2.168.192.in-addr.arpa. (42)
6 packets captured
9 packets received by filter
0 packets dropped by kernel
